Name,Subtitle Data,Subtitle Part
Strange Behavior,"long tough drive down to this jerk town. Yeah, took Route 66 all the way. Thanks. Well, good luck. Ye",part 200
Strange Behavior,"ah, it gets routine. We've seen plenty. Hell, back in '55 we found nine bodies in one house. Nurses. Y",part 201
Strange Behavior,"ou wouldn't believe it. I tell you, there was different parts of different bodies in different rooms.",part 202
Strange Behavior,"You get the picture. One nurse, we couldn't find all the parts. Had to make up kind of a composite of",part 203
Strange Behavior,"bits and pieces missing from all the other bodies. You know, a nice little ass here, a little tit over",part 204
Strange Behavior,"there. It all added up. One guy did 'em all. Yeah, he's back on the street now. Oh, sure, got out of",part 205
Strange Behavior,Joliet a couple of years ago. I'll be back in an hour. It's three minutes after nine and my name is Ro,part 206
Strange Behavior,"ger Maynard. The question tonight on Talkathon, what will you do if the big bomb hits Chicago tomorrow",part 207
Strange Behavior,"? My number is six... Leaving the boy alone in an empty house. What a mess. Timothy, I'm here. Kid nev",part 208
Strange Behavior,er listens. Not that that's surprising. Parents been away so much. Timothy! I can make you a snack now,part 209
Strange Behavior,". Never saw such bad table manners. No wonder. Parents like that. Hey, Timothy. I think the least you",part 210
Strange Behavior,"can do is come down here and say hello to me. The things that kid makes me do. Okay, Timothy, you can'",part 211
Strange Behavior,"t get away now. I don't have to scream above that noise. Not clever enough, young fella, I know you're",part 212
Strange Behavior,in there! Still the kid doesn't answer me. Timothy? Is anything wrong? Timothy? I'm coming in. Eleven,part 213
Strange Behavior,"years old and still leaves the water... Oh, thank God, Mildred! Where's Mr. Brady? Get him! Please, h",part 214
Strange Behavior,"urry. Oh, thank God, Mr. Brady! There's been the most horrible... The Hoffman boy. Yes. Yes, I will. P",part 215
Strange Behavior,"lease. Timothy? God! Who are you? Oh, stop, please! Oh, oh! Shut up, Mildred, and listen to me. She's",part 216
Strange Behavior,"about 20 years old, brown hair, fat! Yeah, well, put him on, will you? Hello, Jordan, listen, get that",part 217
Strange Behavior,"goddamn stuff down here, will you? We're waiting for it. All right. Right. Randy, these guys are dete",part 218
Strange Behavior,"ctives from Chicago. This is Randall Morgan, our mayor. Oh, Mr. Morgan, now listen, we're gonna do eve",part 219
Strange Behavior,rything we can. The scientific stuff is on the way down from Chicago. I don't know if it's gonna do an,part 220
Strange Behavior,"y good. Right now all we got to go on is the description of the killer from last night. That was um, y",part 221
Strange Behavior,"oung overweight female. Look, I just hope we got enough troops to get us through tonight without an in",part 222
Strange Behavior,cident. That's it? Four people killed in this town and that's all you know? Randy! I'm gonna find out,part 223
Strange Behavior,"who did this, I swear to God. I promise you that. I know, John. I'm sorry. I just buried my boy. Where",part 224
Strange Behavior,"'s Caroline? She comes in at four today. Name? Well, there they are, 2000 girls. May I ask what you're",part 225
Strange Behavior,gonna do with them? We're going to find the fat ones. Here are the files from the college. 135 overwe,part 226
Strange Behavior,"ight girls. All right, let's get started. Pete, would you follow me, please? Well, so far I've come up",part 227
Strange Behavior,"with five dark-haired ones, all sharing the same dorm and I got about some eight in the psychology de",part 228
Strange Behavior,partment and three lacrosse players. - Lacrosse? - Yeah. What's that about the psychology department?,part 229
Strange Behavior,I don't know what it means. Some program called 104 or something. Let me see that. I think we should g,part 230
Strange Behavior,"o up there right now and check this out. Oh, what a minute. We haven't even seen all the profiles yet.",part 231
Strange Behavior,"They been running wacko experiments up there for years, the government pays for everything. It's bull",part 232
Strange Behavior,"shit! Well, whatever they're doing, they've got girls that fit the description. There are four more. I",part 233
Strange Behavior,"feel like one of the animals. Now, I'll just strap your arms in. Do you have to? It's for your own pr",part 234
Strange Behavior,otection. What we're going to do today is a little delicate and I need you immobile. Wait a minute. Wa,part 235
Strange Behavior,"it a minute, I'd like to know a little more about what's going on before you start. This is a very, ve",part 236
Strange Behavior,"ry exciting experiment. How did you feel after your pill yesterday? Anything strange? No, I felt prett",part 237
Strange Behavior,"y good, but what are we gonna do today? Could you be a little more specific, please? Well, we're going",part 238
Strange Behavior,"to do an experiment on the chemical reaction of the limbic system. Could you look this way, please? W",part 239
Strange Behavior,"hat are those needles for? What are you sticking me with? Yesterday we worked on your memory, today we",part 240
Strange Behavior,"'re going to work on your motor responses. Like that chicken in the classroom? In a way, yes. No fucki",part 241
Strange Behavior,"n' way, lady! I'm not doing this shit. Now, Pete, just relax. Forget it, come on, please. Just relax.",part 242
Strange Behavior,"Please, listen, I won't tell anybody. Please. Oh, really, you won't remember a thing, really. Just let",part 243
Strange Behavior,"me, let me go! Pete, I... Let me go! See ya, Brenda. Bye. Can I help you? Yeah, you can get Mrs. Park",part 244
Strange Behavior,"inson out here. It would help if I had a name. Brady, John Brady. Chief Brady. I'm sorry, but she won'",part 245
Strange Behavior,"t be available for the next few hours. Let me put it to you this way, honey. You either get her down h",part 246
Strange Behavior,"ere or I go in. Now, just relax, Pete, it'll be over in no time. It'll be just like yesterday, you won",part 247
Strange Behavior,"'t feel a thing. Excuse me, Pete. Help, somebody, help! Thank you. Brady's here to see you. I don't kn",part 248
Strange Behavior,"ow, Brady. I've been working homicide for over 20 years and why you're up here looking at a bunch of p",part 249
Strange Behavior,igeons and rabbits and ducks and rats beats the hell out of me. Mr. Brady. Haven't seen you in years.,part 250
Strange Behavior,"What can I do for you gentlemen? You been doing experiments on fat girls up here, Parkinson? We have a",part 251
Strange Behavior,"small student program for obesity, yes. Even some of the faculty members and their wives have joined",part 252
Strange Behavior,"in. It's a little informal, but it's been very successful in helping them all lose weight. Save the cr",part 253
Strange Behavior,ap for somebody else. You got a list of the people in the program? We've heard your views on our work,part 254
Strange Behavior,"in the past, Mr. Brady. I won't have you maligning us again. And now, gentlemen, I presume you're here",part 255
Strange Behavior,to make some inquiries about these murders in Galesburg. How can I help you? You got a list of people,part 256
Strange Behavior,"in the program? Well, as I said, it's very informal. But I'm sure we do, yes. Now, bring up what you'",part 257
Strange Behavior,"ve got on the weight program, would you? Thank you. Thank you. May I ask what this is for? No. Listen,",part 258
Strange Behavior,"Mrs. Parkinson, now we happen to know that last night's killer was a young, overweight female. Certai",part 259
Strange Behavior,"nly not very much to go on, is it? Well, if you'll excuse me, gentlemen, I really was in the middle of",part 260
Strange Behavior,"something rather important. Parkinson! What the hell's this? That was left in honor of Dr. LeSange, w",part 261
Strange Behavior,"hen he died three years ago. Yeah, I know when he died, Parkinson, I want to know what it's doing here",part 262
Strange Behavior,". It's not doing anything, Mr. Brady, it just happens to be there. Now, if you don't mind, I'm really",part 263
Strange Behavior,"very busy. Open it up. Oh, Doctor. Open it up, Parkinson. John, this is all in the past. I know you're",part 264
Strange Behavior,"in a great deal of pressure, we all are, but... Quit stalling and open the fucking door! Happy, Mr. B",part 265
Strange Behavior,"rady? Help me! Excuse me! What are you doing back here? Well, I was just taking my break. Well, just g",part 266
Strange Behavior,"o back to work. Go on. Now, we're running very late and I wish you'd stop all this. Jesus. My pop has",part 267
Strange Behavior,"a permit... No, no, no, it's okay, it's okay. Let me have one of those. What color would you like? Uh,",part 268
Strange Behavior,"pink. I know she'll love 'em. Yeah, she'll love 'em. How do you feel? Good. A little weak, maybe. Wel",part 269
Strange Behavior,"l, Pete, our work is over. Thank you for contributing to the program. I have a slight headache. It'll",part 270
Strange Behavior,pass. You can collect your check from Mrs. Wiser. What time is it? Almost seven. It's funny. I don't r,part 271
Strange Behavior,"emember falling asleep. Goodbye, Pete. I don't know why, but I've been hungry ever since I met you. Co",part 272
Strange Behavior,"uld you eat? Well, depends. I got an idea, let's go over to Steak N Shake. You can meet Barbara. All r",part 273
Strange Behavior,"ight, sure, I'd like that. Can I fix you something? You sure? I bought a new dress. Pretty? I know it'",part 274
Strange Behavior,"s crazy, with all this going on, I just thought it might make me feel better. It's got this beautiful",part 275
Strange Behavior,"slip. Well. John, stop thinking about it. Doesn't do you any good. I know you think it's crazy, but it",part 276
Strange Behavior,"'s the only way I can see it. Last couple of days I've been trying to figure it out, you know? I mean,",part 277
Strange Behavior,"why would anybody wanna kill Randy's boy, Jake Davis's boy? Now Frank Hoffman's. Three of the best-li",part 278
Strange Behavior,"ked men in this town, all of them born here. Don't you see? See what? These were the guys who sided wi",part 279
Strange Behavior,"th me. LeSange is getting his revenge. Oh. Oh, John, please. You know, when I first read that he'd die",part 280
Strange Behavior,"d, I wondered why I didn't feel happy. Relieved, vindicated, you know? And then I realized it was 'cau",part 281
Strange Behavior,"se I just didn't believe it. I mean, I knew that he wouldn't just disappear like that without trying t",part 282
Strange Behavior,"o get back at me. He's too... He's too evil, too smart. You know, I actually had a chance to kill him",part 283
Strange Behavior,once? It was about six months after Katharine's funeral and I was alone in a room with him and I could,part 284
Strange Behavior,"n't do it. John, I can't listen to you talk this way anymore. It's over. I sat here and listened to yo",part 285
Strange Behavior,u talk this way for five years. Five years and it was hard on me. Very hard. But you started to come b,part 286
Strange Behavior,ack. I can't go through that again. I can't watch you go away from me again. She's dead. And he's dead,part 287
Strange Behavior,"and the dead don't come back and take revenge, they don't. He isn't dead. What? He isn't dead. I know",part 288
Strange Behavior,"it. John, where are you going? John? Oh, no, Barbara's not here. No, it's just me tonight. Can I fix",part 289
Strange Behavior,"you anything? Yeah, I guess we'll have something. Pete, what's wrong? I don't feel so good. Pete! What",part 290
Strange Behavior,"'s the trouble here? Are you okay? Yeah, somebody help me to the bathroom. I'm sorry. It's okay. Sorry",part 291
Strange Behavior,". You okay in there? You okay? Yeah, yeah, I'll be right out. I'm sorry. Oh, it's okay. I gotta go. I'",part 292
Strange Behavior,"ll drop you off. No, I'll take you home. John? John? John? John? John? John? They buried the sumbitch",part 293
Strange Behavior,"in a three bedroom house. John. This is crazy. Stay out of the way, Barbara. What do you think you're",part 294
Strange Behavior,"going to find, John? Think you can get your fingers in there? What? Can you get your fingers in here?",part 295
Strange Behavior,"In there? Never mind, I'll get it with this. Just get out of the way, this thing could take your foot",part 296
Strange Behavior,"off. Come on, you fucker. Oh! Look at this. Who are you? I'm Caroline, Mr. Brady, I met you... Don't y",part 297
Strange Behavior,"ou kids leave this house. Pete, where is he? He's upstairs. What's going on? Dad? Tell me what's happe",part 298
Strange Behavior,ning. You need to stay here with the girls. I'm not kidding. Don't leave the house till I get back. Jo,part 299
Strange Behavior,"hn, be careful! John, do you want me to call Donovan? Do you want me to call the state police? Do you",part 300
Strange Behavior,"want me to call anybody? Oh, God, what can I do? Barbara? What's going on, where is he going? It's...",part 301
Strange Behavior,"It's started all over again. Barbara, where is he going? Anyway, she found it hard to give it all up w",part 302
Strange Behavior,"hen she married your dad. She was so devoted to her work. 'Course, people in town said it was the doct",part 303
Strange Behavior,"or she was devoted to, but I never believed that. Anyway, they were very happy together, especially ar",part 304
Strange Behavior,ound the time you were born. But your mom wasn't the kind of woman to stay at home. So she went back t,part 305
Strange Behavior,o work about a year later. And that's when all that scandal started. All that whispering in town about,part 306
Strange Behavior,things going on at the college and all those crazy experiments Dr. LaSange was doing with all his peo,part 307
Strange Behavior,"ple. And about that time, your dad noticed some changes in your mom, too. She'd come home from work an",part 308
Strange Behavior,"d she'd be on edge and she'd be... Upset about her work. And so she decided to quit. Well, then the la",part 309
Strange Behavior,"st few weeks, she would stay up there late at night trying to finish her work. And one night... She di",part 310
Strange Behavior,"dn't come home. So he went up there to find her. She was lying across her desk, all pale and unconscio",part 311
Strange Behavior,"us and she couldn't get her breath. And later, at the hospital, we were all there, she said it was lik",part 312
Strange Behavior,"e she was drowning and like, like somebody was... Smothering her. And it took over an hour and then sh",part 313
Strange Behavior,"e died. And um... Your father just wouldn't believe the reports, you know, she had this history of ast",part 314
Strange Behavior,"hma, but he wouldn't believe it. He always believed that there was a connection between LaSange and he",part 315
Strange Behavior,"r death. Well, I moved away to Florida after that and got a lot of letters from your dad. He was alway",part 316
Strange Behavior,"s trying to come up with something new, but nothing ever turned up till now. I've gotta get to him. Pe",part 317
Strange Behavior,"te, you can't help him. Nobody can help him. Pete, don't you think we should call the police? We don't",part 318
Strange Behavior,"need them. Look, you can't drive in that condition! Parkinson! Mr. Brady, I see you've found your way",part 319
Strange Behavior,". Can you hear me all right? Yeah, I can hear you. Pete, what did they do to you up there? They're wai",part 320
Strange Behavior,"ting What is wrong with you? You're acting so weird. Pete, stop the car, just pull over. Please sit do",part 321
Strange Behavior,"wn, Mr. Brady, I assure you there is no way out. There's no way out for you this time, sweetheart. LaS",part 322
Strange Behavior,"ange! I know you're in there, asshole. I know you can hear me. Relax, Mr. Brady. Parkinson. You cold-h",part 323
Strange Behavior,"earted bitch. You remember me, don't you? I'm gonna take good care of you. I'm gonna give you the big",part 324
Strange Behavior,"one this time, honey. I'm gonna do these rabbits here a favor, I'm gonna blow the two of you off the f",part 325
Strange Behavior,"ucking planet. My God, kid, what did they do to you? Oh, shit, what did they do? What did you do? Now,",part 326
Strange Behavior,"before we begin, Pete, I want you to take the gun from Mr. Brady. Pete. Listen. We can take 'em, we c",part 327
Strange Behavior,"an stop 'em. Peter, don't do this. The choice is yours, Mr. Brady. Either give him the gun or shoot hi",part 328
Strange Behavior,"m. I can't stop you. I don't have a gun. The choice is yours, Mr. Brady. Pete. That a boy. Let me have",part 329
Strange Behavior,"it. That a boy. Well done, Pete. Now let's get him ready. Come on, guys, this isn't the night to be o",part 330
Strange Behavior,"ut playing. She looks dead. Oh my God, she's dead! Would you shut up, she's breathing for Christ's sak",part 331
Strange Behavior,"e. Oh my God. Pete? It'll be all right. We'll take you to the infirmary, it's just down the hill. Pete",part 332
Strange Behavior,". Gotta find Pete. Shh, everything'll be all right. Come on out here where I can see you. Hello, Mr. B",part 333
Strange Behavior,"rady. Surprised to see me? The shock. As you can see, my legs have gone, but I live on. I would give u",part 334
Strange Behavior,"p my organs one at a time if necessary to continue my work. Since I have been buried, since I have bee",part 335
Strange Behavior,"n officially dead, I have been able to make great progress. I shoulda killed you when I had the chance",part 336
Strange Behavior,". Ah, but you didn't. That's the difference between us. Your pathetic, sleepy little town. You people",part 337
Strange Behavior,know nothing. You know nothing about the real world. What did you do to my kid? Quite an impressive yo,part 338
Strange Behavior,"ung man. He has his mother's genes. Now, there was a woman of great intelligence and talent. I was sor",part 339
Strange Behavior,"ry to lose her. She was so happy before she met you, so dedicated. I miss her. Sometimes. Oh, you bett",part 340
Strange Behavior,"er shut your mouth! And tonight, Pete will be the beneficiary of our years of research. My new drug. Y",part 341
Strange Behavior,"ou're about to see a demonstration. A forceful demonstration, I hope, of just what it can do. It is re",part 342
Strange Behavior,"markable. In time it can be used to empty out prisons, to teach backward children, to help the disturb",part 343
Strange Behavior,"ed. Our society can be rebuilt. Pete. Don't hesitate, now, do exactly as I told you. Oh, Jesus. The ot",part 344
Strange Behavior,"her carve now. Don't do that! Oh, Jesus. LeSange, this is between you and me, this doesn't have anythi",part 345
Strange Behavior,"ng to do with him! Leave him out of this! I assure you, Pete will not be harmed. I could not do that t",part 346
Strange Behavior,"o Katharine's son. My drug will wear off in a few hours. There will be no memory, no guilt. Pete, are",part 347
Strange Behavior,"you ready? Pete... Kill your father. Pete, don't. Don't do it. Pete, don't. Don't do it, don't. Don't.",part 348
Strange Behavior,"Pete, finish up, please. Kill your father now. Pete, don't, don't, don't. Don't do it. Don't do it. D",part 349
Strange Behavior,"on't do it. Don't do it. Do not stop again, kill your father. No, Pete, no! No, Pete, your father, kil",part 350
Strange Behavior,"l your father! You are my father. Stop it! Come on, over there. Come on. Move these people back away f",part 351
Strange Behavior,"rom the rear of the car. Ah, step back, folks. Back, please. Alvin? Where the hell is that guy? We got",part 352
Strange Behavior,"ta go. It's late, they'll be there by now. What'll it be, guys? Congratulations, John, I heard the goo",part 353
Strange Behavior,"d news. Oh, thanks, Alvin. Uh, let me have a beer and a little taste of that bourbon. Me, too. I'll ju",part 354
Strange Behavior,"st have a beer, thanks. Do you have an ID? Alvin, this is my kid. What's the matter with you? Didn't r",part 355
Strange Behavior,"ecognize you in your suit. Dear friends, let us turn to the Lord and pray. Bye! Were you nervous? Well",part 356
Strange Behavior,", it's over now. He looked great, didn't he? I just kept looking at him and thinking he looked just gr",part 357
Strange Behavior,eat.,part 358
Come Play with Me,♪ Play with me ♪ ♪ Come play with me ♪ ♪ Come baby play with me ♪ ♪ Come on come on take me by the han,part 1
Come Play with Me,d ♪ ♪ You and me can go on some strange erotic land ♪ ♪ You will see ♪ ♪ That it's not as bad as it's,part 2
Come Play with Me,made out to be ♪ ♪ Not with me ♪ ♪ We can go go on to some magic carpet trip ♪ ♪ And I know we're into,part 3
Come Play with Me,love and partnership ♪ ♪ Wait and see ♪ ♪ What the pleasures of the world can really be with me ♪ ♪ C,part 4
Come Play with Me,ome play with me ♪ ♪ Take me by the hand and stay with me come away with me ♪ ♪ Play with me ♪ ♪ Come,part 5
Come Play with Me,play with me ♪ ♪ Got to make you want to stay with me ♪ ♪ What do you say to me ♪ ♪ Play with me ♪ - H,part 6
Come Play with Me,e doesn't like it. He doesn't like it at all. (grumbling) Have any of you been able to gather any furt,part 7
Come Play with Me,her information? It just isn't good enough. The whole party could be in jeopardy if this fiasco leaks,part 8
Come Play with Me,"out. We've got to nip it in the bud! - As Minister of Finance, I feel the solution should be to change",part 9
Come Play with Me,"to another colour. Change the notes from blue to red or something. - No, no, no, it just won't do. Ho",part 10
Come Play with Me,"w long do you think it would take the organisation to copy a new issue? Last month, there were over a",part 11
Come Play with Me,"million in circulation. No, no, no, the only solution is to locate and apprehend the forgers. Well, wh",part 12
Come Play with Me,"at suggestions have any of you got to make? It's calamity! If something isn't accomplished soon, heads",part 13
Come Play with Me,will roll. - I believe that this is the work of an international gang. Probably working from the cont,part 14
Come Play with Me,inent. Sponsored by you know whom. - I disagree. Take a look at this map. Over the past four months it,part 15
Come Play with Me,"appears that the forgeries have been centralised in limited areas of the country. Cumberland, Yorkshi",part 16
Come Play with Me,"re and three weeks ago, Norfolk. I would say that the organisation is operating right here in Britain,",part 17
Come Play with Me,probably a giant network with various headquarters throughout the country. - I go along with that. An,part 18
Come Play with Me,"d gentlemen, you realise that each operation appears to edge its way further down the country. I will",part 19
Come Play with Me,"guarantee that the next outbreak will be on the south coast, possibly somewhere in Sussex. Gentlemen,",part 20
Come Play with Me,"I see no point in wasting your valuable time. I suggest you return to your duties. Er, Podsnap, I'd be",part 21
Come Play with Me,obliged if you could stay behind for a few more moments. - Certainly Minister. - Points I want to pic,part 22
Come Play with Me,"k up. (men chattering) - Don't worry Minister, my country will back you up. - And Miss Dingle, perhaps",part 23
Come Play with Me,you should remain as well. You do realise that the bulk of the responsibility lies with your departme,part 24
Come Play with Me,"nt, don't you? - I do assure you Minister, we really are doing all we can. I'm sure that we'll come up",part 25
Come Play with Me,with something before long. No doubt about it. I've got some of my best undercover men full out. - So,part 26
Come Play with Me,"me of them isn't enough. You have to get the whole branch out on this. What about your key man, what d",part 27
Come Play with Me,"o you call him, 008 or something? - Regretfully, we lost him last month. - Oh. - He's dead. - Oh dear.",part 28
Come Play with Me,"How did it happen? - He caught the flu. - Oh, well nothing serious then. Well, who else have you got",part 29
Come Play with Me,"and what about your outside contacts? - I have one of my uh, contacts lined up. I expect to meet with",part 30
Come Play with Me,him within the next few days. I am waiting for confirmation. You have nothing more to worry about. - W,part 31
Come Play with Me,ell please get on with it man! The situation is more serious than you can imagine. I expect a report f,part 32
Come Play with Me,"rom you during the next two days. - I understand perfectly, you may rely on me. - I intend to. I shan'",part 33
Come Play with Me,"t require you any further, Podsnap. - Right, thank you, good morning Minister. (car door clicks) (step",part 34
Come Play with Me,"s clattering) (lock rattles) - I'm telling you Slash, they're both blowing the gaff. Yeah, there's not",part 35
Come Play with Me,"a bloody stick left anywhere! They've even go a bleedin' lock on the door! Yeah, everything, the mach",part 36
Come Play with Me,"ines, the plates, the optics. You what? All right yeah, I'll come straight back to the club. (groovy m",part 37
Come Play with Me,"usic) (door knocks) - You're next miss! - Coming! (playful piano music) - [Man] Go on, come on give us",part 38
Come Play with Me,"a dance, I love your tempo. Keep it going, keep it going. Come on love, now look at the audience. You",part 39
Come Play with Me,"'re working, you're working to us. Remember, you got the house full. Keep it going, lovely. That's it,",part 40
